kategori,nama_wisata,latitude,longitude,alamat,provinsi,kota_kabupaten
taman,Taman Nasional Bukit Tigapuluh,-1.3718082,102.4791044,"Resort Taman Nasional Bukit Tigapuluh, Jalan Rigunas, Tebo, Jambi, Sumatera, Indonesia",Jambi,Tebo
gunung,Gunung Rinjani,-8.4117272,116.4581059,"Rinjani, Lombok Timur, Nusa Tenggara Barat, Nusa Tenggara, Indonesia",Nusa Tenggara Barat,
mall,Royal Plaza Surabaya,-7.3091349,112.7342835,"Royal Plaza, 16-18, Jalan Jenderal Achmad Yani, RW 04, Wonokromo, Surabaya, Jawa Timur, Jawa, 60231, Indonesia",Jawa Timur,Surabaya
wisata kuliner,Rujak Cingur Genteng Surabaya,-7.2554948,112.740236,"Rujak Cingur Ahmad Jais, No.40, Jalan Achmad Jais, RW 02, Peneleh, Genteng, Surabaya, Jawa Timur, Jawa, 60274, Indonesia",Jawa Timur,Surabaya
rumah adat,Rumah Adat Banjar Kalimantan Selatan,-2.634037,115.0957531,"Rumah Adat Banjar Bubungan Tinggi Habirau, Jalan Raya Negara, Habirau, Hulu Sungai Selatan, Kalimantan Selatan, Kalimantan, Indonesia",Kalimantan Selatan,Hulu Sungai Selatan
rumah adat,Rumah Adat Buton Baubau,-4.6872524,123.0221566,"Rumah Adat Lambale, Jalan Poros Ereke-Baubau, Kulisusu Barat, Kotawo, Kulisusu Barat, Buton Utara, Sulawesi Tenggara, Sulawesi, Indonesia",Sulawesi Tenggara,Buton Utara
rumah adat,Rumah Adat Lamin Kalimantan Timur,0.1978164,117.4729648,"Rumah Adat Lamin Kutai Guntung, Jalan Tari Gong, Guntung, Bontang, Kalimantan Timur, Kalimantan, 75321, Indonesia",Kalimantan Timur,Bontang
rumah adat,Rumah Adat Enrekang Sulawesi Selatan,-3.6103967,119.8797063,"Rumah Adat Matakali, Jalan Poros Maiwa - Bungin, Matakali, Maiwa, Enrekang, Sulawesi Selatan, Sulawesi, Indonesia",Sulawesi Selatan,Sulawesi
rumah adat,Rumah Adat Toraja Utara,-2.9860708,119.9527722,"rumah adat, Jalan Andi Achmand, Tondon, Toraja Utara, Sulawesi Selatan, Sulawesi, 91813, Indonesia",Sulawesi Selatan,Toraja Utara
rumah adat,Rumah Adat Gadang Sumatera Barat,-1.4595663,101.0315028,"rumah adat, Pasir Talang, Solok Selatan, Sumatera Barat, Sumatera, Indonesia",Sumatera Barat,Solok Selatan
wisata edukasi,Rumah Atsiri Indonesia,-7.6546345,111.1014613,"Rumah Atsiri Indonesia, Jalan Tawangmangu - Palaosan, Plumbon, Karanganyar, Jawa Tengah, Jawa, Indonesia",Jawa Tengah,Karanganyar
wahana keluarga,Saloka Theme Park,-7.2801381,110.457617,"Saloka Theme Park, Gumuksari, Lopait, Kabupaten Semarang, Jawa Tengah, Jawa, Indonesia",Jawa Tengah,Kabupaten Semarang
wisata kuliner,Sate Klatak Pak Pong,-7.8680486,110.3905995,"Sate Klatak pak Pong, Jalan Imogiri Timur, Wonokromo, Pleret, Bantul, Daerah Istimewa Yogyakarta, Jawa, 55791, Indonesia",Daerah Istimewa Yogyakarta,Bantul
wisata kuliner,Sate Maranggi Cibungur,-6.4717694,107.4804409,"Sate Maranggi Cibungur, Jalan Raya Ciwangi, Cibungur, Purwakarta, Jawa Barat, Jawa, 41181, Indonesia",Jawa Barat,Purwakarta
wisata kuliner,Sate Padang Ajo Ramon Jakarta,-6.241668,106.8104485,"Sate Padang Ajo Ramon, Jalan Cikajang, RW 05, Petogogan, Kebayoran Baru, Jakarta Selatan, Daerah Khusus ibukota Jakarta, Jawa, 12170, Indonesia",,Daerah Khusus ibukota Jakarta
wisata edukasi,Sea World Ancol,-6.1271335,106.8415805,"Sea World, Jalan Lodan Raya, Kawasan Wisata Ancol, Ancol, Pademangan, Jakarta Utara, Daerah Khusus ibukota Jakarta, Jawa, 14430, Indonesia",,Daerah Khusus ibukota Jakarta
mall,Senayan City,-6.2273179,106.7971805,"Senayan City, Jalan Asia Afrika, RW 02, Gelora, Tanah Abang, Jakarta Pusat, Daerah Khusus ibukota Jakarta, Jawa, 10270, Indonesia",,Daerah Khusus ibukota Jakarta
wahana keluarga,Sindu Kusuma Edupark,-7.7658888,110.3557753,"Sindu Kusuma Edupark, Jalan Jambon V, Kricak, Tegalrejo, Sinduadi, Mlati, Sleman, Daerah Istimewa Yogyakarta, Jawa, 55242, Indonesia",Daerah Istimewa Yogyakarta,Sleman
wisata tematik,Sindu Kusuma Edupark Jogja,-7.7658888,110.3557753,"Sindu Kusuma Edupark, Jalan Jambon V, Kricak, Tegalrejo, Sinduadi, Mlati, Sleman, Daerah Istimewa Yogyakarta, Jawa, 55242, Indonesia",Daerah Istimewa Yogyakarta,Sleman
mall,Solo Paragon Mall,-7.5624618,110.8099966,"Solo Paragon Mall, Jalan Yosodipuro, Purwosari, Surakarta, Jawa Tengah, Jawa, 57139, Indonesia",Jawa Tengah,Surakarta
wisata kuliner,Soto Lamongan Cak Har Surabaya,-7.295653,112.7812929,"Soto Ayam Lamongan Cak Har, No.220, Jalan Klampis Harapan X, RW 08, Klampis Ngasem, Sukolilo, Surabaya, Jawa Timur, Jawa, 60119, Indonesia",Jawa Timur,Surabaya
mall,Summarecon Mall Bekasi,-6.2259971,107.0010731,"Summarecon Mall Bekasi, Jalan Bulevar Ahmad Yani, Summarecon Bekasi, Summarecon, Margajaya, Bekasi, Jawa Barat, Jawa, 17142, Indonesia",Jawa Barat,Bekasi
mall,Summarecon Mall Serpong,-6.2406997,106.6284149,"Summarecon Mall Serpong, Jalan Boulevard Gading Serpong, Gading Serpong, Rumpak Sinang, Pakulonan Barat, Kelapa Dua, Kabupaten Tangerang, Jawa, 15811, Indonesia",,Kabupaten Tangerang
mall,Sun Plaza Medan,3.5822609,98.6719101,"Sun Plaza, 7, Jalan Jenggala, Medan Polonia, Kota Medan ᯔᯩᯑᯉ᯲, Sumatera Utara, Sumatera, 20152, Indonesia",Sumatera Utara,Kota Medan ᯔᯩᯑᯉ᯲
wahana keluarga,Taman Impian Jaya Ancol,-6.1215807,106.8371407,"Taman Impian Jaya Ancol, No.7, Jalan Pademangan VIII, RW 10, Pademangan Timur, Pademangan, Jakarta Utara, Daerah Khusus ibukota Jakarta, Jawa, 14430, Indonesia",,Daerah Khusus ibukota Jakarta
wisata tematik,Taman Lalu Lintas Bandung,-6.9124701,107.6138388,"Taman Lalu Lintas, Jalan Belitung, Merdeka, Sumur Bandung, Kota Bandung, Jawa Barat, Jawa, 40117, Indonesia",Jawa Barat,Kota Bandung
kebun binatang,Kebun Binatang Kasang Kulim Pekanbaru,0.4189627,101.4062602,"Taman Marga Satwa Kasang Kulim, Jalan Kebun Binatang, Pekanbaru, Kampar, Riau, Sumatera, 25258, Indonesia",Riau,Pekanbaru
wahana keluarga,Taman Mini Indonesia Indah,-6.3026341,106.8952962,"Taman Mini Indonesia Indah, Gang An Nur 2C, RW 10, Lubang Buaya, Cipayung, Jakarta Timur, Daerah Khusus ibukota Jakarta, Jawa, 13810, Indonesia",,Jakarta Timur
wisata tematik,Taman Mini Indonesia Indah Jakarta,-6.3026341,106.8952962,"Taman Mini Indonesia Indah, Gang An Nur 2C, RW 10, Lubang Buaya, Cipayung, Jakarta Timur, Daerah Khusus ibukota Jakarta, Jawa, 13810, Indonesia",,Jakarta Timur
taman,Taman Nasional Aketajawe-Lolobata,0.5894491,127.7387051,"Taman Nasional Aketajawe Lolobata, Halmahera Tengah, Maluku Utara, Maluku, Indonesia",Maluku Utara,Halmahera Tengah
taman,Taman Nasional Alas Purwo,-8.6135534,114.3981629,"Taman Nasional Alas Purwo, Banyuwangi, Jawa Timur, Jawa, Indonesia",Jawa Timur,Banyuwangi
taman,Taman Nasional Baluran,-7.8363697,114.3808459,"Taman Nasional Baluran, Situbondo, Banyuwangi, Jawa Timur, Jawa, Indonesia",Jawa Timur,Situbondo
taman,Taman Nasional Bantimurung Bulusaraung,-4.8683732,119.6930821,"Taman Nasional Bantimurung Bulusaraung, Pangkajene dan Kepulauan, Sulawesi Selatan, Sulawesi, Indonesia",Sulawesi Selatan,Pangkajene dan Kepulauan
taman,Taman Nasional Batang Gadis,0.8899134,99.3400377,"Taman Nasional Batang Gadis, Mandailing Natal, Sumatera Utara, Sumatera, Indonesia",Sumatera Utara,Mandailing Natal
taman,Taman Nasional Berbak,-1.4093264,104.2228031,"Taman Nasional Berbak, Tanjung Jabung Timur, Jambi, Sumatera, Indonesia",Jambi,Tanjung Jabung Timur
taman,Taman Nasional Bogani Nani Wartabone,0.5810207,123.549791,"Taman Nasional Bogani Nani Wartabone, Bolaang Mongondow Utara, Sulawesi Utara, Sulawesi, Indonesia",Sulawesi Utara,Bolaang Mongondow Utara
taman,Taman Nasional Bromo Tengger Semeru,-8.0254422,112.949168,"Taman Nasional Bromo Tengger Semeru, Kabupaten Malang, Jawa Timur, Jawa, 67254, Indonesia",Jawa Timur,Kabupaten Malang
taman,Taman Nasional Bukit Baka Bukit Raya,-0.7158521,112.5860848,"Taman Nasional Bukit Baka Bukit Raya, Katingan, Kalimantan Tengah, Kalimantan, Indonesia",Kalimantan Tengah,Katingan
taman,Taman Nasional Danau Sentarum,0.8367767,112.1830307,"Taman Nasional Danau Sentarum, Kapuas Hulu, Kalimantan Barat, Kalimantan, 78775, Indonesia",Kalimantan Barat,Kapuas Hulu
gunung,Gunung Ciremai,-6.8800193,108.4104831,"Taman Nasional Gunung Ciremai, Maniskidul, Kuningan, Jawa Barat, Jawa, Indonesia",Jawa Barat,Kuningan
taman,Taman Nasional Gunung Ciremai,-6.8800193,108.4104831,"Taman Nasional Gunung Ciremai, Maniskidul, Kuningan, Jawa Barat, Jawa, Indonesia",Jawa Barat,Kuningan
taman,Taman Nasional Gunung Gede Pangrango,-6.7752118,106.9311234,"Taman Nasional Gunung Gede Pangrango, Kadudampit, Megamendung, Kab Sukabumi, Jawa Barat, Jawa, Indonesia",Jawa Barat,Kab Sukabumi
taman,Taman Nasional Gunung Halimun Salak,-6.7417746,106.4540374,"Taman Nasional Gunung Halimun-Salak, Lebak, Banten, Jawa, 16696, Indonesia",Banten,Lebak
taman,Taman Nasional Gunung Leuser,3.4925578,97.5593699,"Taman Nasional Gunung Leuser, Aceh, Sumatera, Indonesia",Aceh,Sumatera
taman,Taman Nasional Gunung Palung,-1.2137375,110.2375269,"Taman Nasional Gunung Palung, Kayong Utara, Kalimantan Barat, Kalimantan, Indonesia",Kalimantan Barat,Kayong Utara
taman,Taman Nasional Tambora,-8.2763787,117.996753,"Taman Nasional Gunung Tambora, Bima, Nusa Tenggara Barat, Nusa Tenggara, Indonesia",Nusa Tenggara Barat,
taman,Taman Nasional Karimunjawa,-5.7970834,110.31,"Taman Nasional Karimunjawa, Jawa Tengah, Jawa, Indonesia",Jawa Tengah,Jawa
taman,Taman Nasional Kerinci Seblat,-2.2619949,101.3594523,"Taman Nasional Kerinci Seblat, Jambi, Sumatera, Indonesia",Jambi,Sumatera
taman,Taman Nasional Komodo,-8.6069899,119.5729395,"Taman Nasional Komodo, Manggarai Barat, Nusa Tenggara Timur, Nusa Tenggara, Indonesia",Nusa Tenggara Timur,Manggarai Barat
taman,Taman Nasional Kutai,0.356592,117.2655867,"Taman Nasional Kutai, Kutai Timur, Kalimantan Timur, Kalimantan, Indonesia",Kalimantan Timur,Kutai Timur
taman,Taman Nasional Lorentz,-4.641344,137.6663697,"Taman Nasional Lorentz, Papua Tengah, Western New Guinea, Indonesia",Papua Tengah,Western New Guinea
taman,Taman Nasional Manusela,-3.0484302,129.2357306,"Taman Nasional Manusela, Maluku Tengah, Maluku, Indonesia",Maluku,Maluku Tengah
taman,Taman Nasional Meru Betiri,-8.4606063,113.85749,"Taman Nasional Meru Betiri, Banyuwangi, Jawa Timur, Jawa, Indonesia",Jawa Timur,Banyuwangi
taman,Taman Nasional Laut Sawu,-10.2885916,120.8349871,"Taman Nasional Perairan Laut Sawu, Nusa Tenggara Timur, Nusa Tenggara, Indonesia",Nusa Tenggara Timur,
taman,Taman Nasional Rawa Aopa Watumohai,-4.3036722,122.0138645,"Taman Nasional Rawa Aopa Watumohai, Konawe Selatan, Sulawesi Tenggara, Sulawesi, Indonesia",Sulawesi Tenggara,Konawe Selatan
taman,Taman Nasional Sebangau,-2.4769018,113.6931414,"Taman Nasional Sebangau, Kalimantan Tengah, Kalimantan, Indonesia",Kalimantan Tengah,Kalimantan
taman,Taman Nasional Siberut,-1.4233193,98.8663082,"Taman Nasional Siberut, Kepulauan Mentawai, Sumatera Barat, Sumatera, Indonesia",Sumatera Barat,Sumatera
taman,Taman Nasional Taka Bonerate,-6.7,121.1541667,"Taman Nasional Taka Bonerate, Sulawesi Selatan, Sulawesi, Indonesia",Sulawesi Selatan,Sulawesi
taman,Taman Nasional Tanjung Puting,-3.0641552,112.0185747,"Taman Nasional Tanjung Puting, Kotawaringin Barat, Kalimantan Tengah, Kalimantan, Indonesia",Kalimantan Tengah,Kotawaringin Barat
taman,Taman Nasional Teluk Cenderawasih,-2.54526,135.0106277,"Taman Nasional Teluk Cenderawasih, Papua Tengah, Western New Guinea, Indonesia",Papua Tengah,Western New Guinea
taman,Taman Nasional Tesso Nilo,-0.2205437,101.8731769,"Taman Nasional Tesso Nilo, Pelalawan, Riau, Sumatera, Indonesia",Riau,Pelalawan
taman,Taman Nasional Ujung Kulon,-6.751449,105.3177956,"Taman Nasional Ujung Kulon, Pandeglang, Banten, Jawa, Indonesia",Banten,Pandeglang
taman,Taman Nasional Wakatobi,-5.9011111,124.1165972,"Taman Nasional Wakatobi, Sulawesi Tenggara, Sulawesi, Indonesia",Sulawesi Tenggara,Sulawesi
taman,Taman Nasional Wasur,-8.5922228,140.7692643,"Taman Nasional Wasur, Papua Selatan, Western New Guinea, Indonesia",Papua Selatan,Western New Guinea
taman,Taman Nasional Way Kambas,-4.9373689,105.7283403,"Taman Nasional Way Kambas, Lampung Timur, Lampung, Sumatera, Indonesia",Lampung,Lampung Timur
wisata lampion,Taman Pelangi Yogyakarta,-7.7502983,110.3694758,"Taman Pelangi Jogja - Taman Lampion, Jalan Ring Road Utara, Sinduadi, Mlati, Sleman, Daerah Istimewa Yogyakarta, Jawa, 55284, Indonesia",Daerah Istimewa Yogyakarta,Sleman
wisata edukasi,Taman Pintar Yogyakarta,-7.8010466,110.3677697,"Taman Pintar Yogyakarta, Kampung Ketandan, Prawirodirjan, Gondomanan, Kota Yogyakarta, Daerah Istimewa Yogyakarta, Jawa, Indonesia",Daerah Istimewa Yogyakarta,Kota Yogyakarta
wahana keluarga,Taman Remaja Surabaya,-7.252909,112.7519455,"Taman Remaja Surabaya, RW 04, Tambaksari, Surabaya, Jawa Timur, Jawa, Indonesia",Jawa Timur,Surabaya
wisata tematik,Taman Safari Prigen,-7.752837,112.667453,"Taman Safari Indonesia Prigen, Taman Safari, Jatiarjo, Pasuruan, Jawa Timur, Jawa, Indonesia",Jawa Timur,Pasuruan
kebun binatang,Taman Safari Indonesia Bogor,-6.7201709,106.9519528,"Taman Safari Indonesia, Jalan Alternatif Gunung Mas, Cisarua, Kab Bogor, Jawa Barat, Jawa, 16750, Indonesia",Jawa Barat,Kab Bogor
kebun binatang,Taman Satwa Banjarmasin,-3.3080067,114.6033845,"Taman Satwa Banjarmasin Bungas, Jalan Jahri Saleh, Sungai Jingah, Banjarmasin Utara, Banjarmasin, Kalimantan Selatan, Kalimantan, 70121, Indonesia",Kalimantan Selatan,Banjarmasin
kebun binatang,Kebun Binatang Cikembulan Garut,-7.0841178,107.9155195,"Taman Satwa Cikembulan

Kebun Binatang Cikembulan, Gang Melati, Cisaat, Neglasari, Kadungora, Garut, Jawa Barat, Jawa, 44152, Indonesia",Jawa Barat,Neglasari
wisata religi,Pura Tanah Lot Bali,-8.6212249,115.0868804,"Tanah Lot, Jalan Enjung Pura, Beraban, Tabanan, Bali, Nusa Tenggara, 82121, Indonesia",Bali,Tabanan
wisata tematik,Tebing Breksi Yogyakarta,-7.7814296,110.5049834,"Tebing Breksi, Alternatif Prambanan-Lemahbang, Sambirejo, Prambanan, Sleman, Daerah Istimewa Yogyakarta, Jawa, 55572, Indonesia",Daerah Istimewa Yogyakarta,Sleman
air terjun,Air Terjun Tegenungan,-8.5752294,115.2907014,"Tegenungan Blangsinga, Sukawati, Gianyar, Bali, Nusa Tenggara, 80582, Indonesia",Bali,Gianyar
wahana keluarga,The Jungle Bogor,-6.6344256,106.7954514,"The Jungle Adventure Water Park, Bogor Selatan, Bogor, Jawa Barat, Jawa, Indonesia",Jawa Barat,Bogor
wahana keluarga,The Park Mall Solo,-7.5988732,110.8163039,"The Park Mall, Jalan Insinyur Soekarno, Grogol, Sukoharjo, Jawa Tengah, Jawa, 57552, Indonesia",Jawa Tengah,Sukoharjo
mall,Balikpapan Plaza,-1.2781938,116.8398348,"The Plaza Balikpapan, Jalan Jenderal Sudirman, Klandasan Ilir, Balikpapan Kota, Balikpapan, Kalimantan Timur, Kalimantan, 76121, Indonesia",Kalimantan Timur,Balikpapan
mall,Pakuwon Mall Jogja,-7.7582576,110.3994486,"TPB RRU Pakuwon Mall Jogja, Ring Road Utara, Condongcatur, Depok, Sleman, Daerah Istimewa Yogyakarta, Jawa, 55283, Indonesia",Daerah Istimewa Yogyakarta,Sleman
wisata edukasi,Trans Studio Bandung,-6.9247021,107.6360969,"Trans Studio Bandung, Jalan Cibangkong Lor, Maleer, Batununggal, Kota Bandung, Jawa Barat, Jawa, 40274, Indonesia",Jawa Barat,Kota Bandung
wahana keluarga,Trans Studio Cibubur,-6.3746768,106.9023871,"Trans Studio Mall Cibubur, Jalan Jambore, RW 05, Pondok Ranggon, Cipayung, Jakarta Timur, Depok ᮓᮦᮕᮧᮊ᮪, Jawa Barat, Jawa, 16454, Indonesia",Jawa Barat,Jakarta Timur
mall,Trans Studio Mall Bandung,-6.9256414,107.6367469,"Trans Studio Mall, #289, Maleer Indah I, Maleer, Batununggal, Kota Bandung, Jawa Barat, Jawa, 40273, Indonesia",Jawa Barat,Kota Bandung
wahana keluarga,Trans Studio Makassar,-5.1588529,119.3940742,"Trans Studio Mall, Maccini Sombala, Tamalate, Makassar, Sulawesi Selatan, Sulawesi, 90134, Indonesia",Sulawesi Selatan,Makassar
mall,Tunjungan Plaza Surabaya,-7.2623869,112.739006,"Tunjungan Plaza, Jalan Mergoyoso, RW 10, Kedungdoro, Tegalsari, Surabaya, Jawa Timur, Jawa, 60011, Indonesia",Jawa Timur,Surabaya
wisata tematik,Upside Down World Bali,-8.7166321,115.2052139,"Upside Down World, Jalan Bypass Ngurah Rai, Pemogan, Denpasar Selatan, Denpasar ᬤᬾᬦ᭄ᬧᬲᬃ, Bali, Nusa Tenggara, 80221, Indonesia",Bali,Denpasar ᬤᬾᬦ᭄ᬧᬲᬃ
wisata religi,Vihara Avalokitesvara Banten,-6.030155,106.1492953,"Vihara Avalokitesvara, Jalan Masjid Agung Banten, Banten, Kasemen, Serang ᮞᮦᮛᮀ, Jawa, Indonesia",,Serang ᮞᮦᮛᮀ
wisata religi,Vihara Buddhagaya Watugong Semarang,-7.0864388,110.4095947,"Vihara Buddhagaya Watugong Semarang, Jalan Perintis Kemerdekaan, RW 09, Pudakpayung, Banyumanik, Kota Semarang, Jawa Tengah, Jawa, 50265, Indonesia",Jawa Tengah,Kota Semarang
wisata religi,Vihara Dhanagun Bogor,-6.6031623,106.7992338,"Vihara Dhanagun, Jalan Surya Kencana, Bogor Tengah, Bogor, Jawa Barat, Jawa, 16122, Indonesia",Jawa Barat,Bogor
wisata religi,Vihara Dharma Bhakti Jakarta,-6.144868,106.7805565,"Vihara Dharma Bhakti, Jalan Kusuma, RW 09, Wijaya Kusuma, Grogol Petamburan, Jakarta Barat, Daerah Khusus ibukota Jakarta, Jawa, 11330, Indonesia",,Daerah Khusus ibukota Jakarta
wisata religi,Vihara Ekayana Arama Jakarta,-6.1777166,106.7784333,"Vihara Ekayana Arama, Jalan Mangga II, RW 08, Duri Kepa, Kebon Jeruk, Jakarta Barat, Daerah Khusus ibukota Jakarta, Jawa, 11430, Indonesia",,Daerah Khusus ibukota Jakarta
wisata kuliner,Soto Kadipiro Yogyakarta,-7.8006662,110.3462144,"Warung Soto Kadipiro, 33, Jalan Wates, Ngestiharjo, Kasihan, Bantul, Daerah Istimewa Yogyakarta, Jawa, 55182, Indonesia",Daerah Istimewa Yogyakarta,Bantul
wahana keluarga,Waterbom Bali,-8.7282927,115.170627,"Waterbom Bali, Gang Kingkong, Kuta, Badung, Bali, Nusa Tenggara, 80361, Indonesia",Bali,Badung
wahana keluarga,Waterboom Jakarta,-6.1132402,106.7490248,"Waterboom Jakarta 2, Jalan Marina Indah, RW 05, Kamal Muara, Penjaringan, Jakarta Utara, Daerah Khusus ibukota Jakarta, Jawa, 14470, Indonesia",,Daerah Khusus ibukota Jakarta
wahana keluarga,Jogja Bay Waterpark,-7.7472493,110.4189062,"Waterboom Jogja, Jalan Utara Stadion, Wedomartani, Sleman, Daerah Istimewa Yogyakarta, Jawa, 55821, Indonesia",Daerah Istimewa Yogyakarta,Sleman
wahana keluarga,Waterboom Lippo Cikarang,-6.3316066,107.138407,"Waterboom Lippo Cikarang, Jalan Menteng Padma, Lippo Cikarang, Sukaresmi, Kab Bekasi, Jawa Barat, Jawa, 17550, Indonesia",Jawa Barat,Jawa
wisata edukasi,Museum Wayang Jakarta,-6.1348145,106.8125091,"Wayang Museum, Taman Fatahillah, RW 06, Pinangsia, Taman Sari, Jakarta Barat, Daerah Khusus ibukota Jakarta, Jawa, 11110, Indonesia",,Daerah Khusus ibukota Jakarta
bukit,Bukit Sekipan Tawangmangu,-7.667803,111.1442694,"Wisata Bukit Sekipan, Jalan Tawangmangu - Palaosan, Nglebak, Karanganyar, Jawa Tengah, Jawa, 57785, Indonesia",Jawa Tengah,Karanganyar
wisata tematik,Watu Goyang Bantul,-7.92706,110.4120656,"Wista watu goyang, Jalan Imogiri - Dlingo, Wukirsari, Imogiri, Bantul, Daerah Istimewa Yogyakarta, Jawa, 55782, Indonesia",Daerah Istimewa Yogyakarta,Bantul
wahana keluarga,Wonderland Karawang,-6.326002,107.2901281,"Wonderland Adventure Waterpark Galuh Mas Karawang, Jalan Raya Galuhmas, Metropolis, Sukaharja, Karawang ᮊᮛᮝᮀ, Jawa Barat, Jawa, 41361, Indonesia",Jawa Barat,Karawang ᮊᮛᮝᮀ
mall,Pluit Village,-6.1162602,106.789693,"WonderMind Pluit Village, Jalan Pluit Indah Raya, RW 04, Pluit, Penjaringan, Jakarta Utara, Daerah Khusus ibukota Jakarta, Jawa, 14450, Indonesia",,Daerah Khusus ibukota Jakarta
